{
  "$schema": "./schema/registry.schema.json",
  "version": "1.0.0",
  "lastUpdated": "2026-01-30T10:09:41.710Z",
  "totalDomains": 8,
  "totalSections": 4,
  "domains": [
    {
      "id": "ecommerce",
      "name": "E-Commerce",
      "description": "Online stores, product catalogs, shopping experiences",
      "icon": "ShoppingCart",
      "color": "#10b981",
      "tier": "free",
      "sectionCount": 1,
      "tags": [
        "retail",
        "shopping",
        "products",
        "checkout",
        "cart"
      ]
    },
    {
      "id": "restaurant",
      "name": "Restaurant",
      "description": "Dining, menus, reservations, food delivery",
      "icon": "UtensilsCrossed",
      "color": "#f59e0b",
      "tier": "free",
      "sectionCount": 1,
      "tags": [
        "food",
        "dining",
        "menu",
        "hospitality",
        "reservation"
      ]
    },
    {
      "id": "real-estate",
      "name": "Real Estate",
      "description": "Property listings, agents, real estate search",
      "icon": "Home",
      "color": "#3b82f6",
      "tier": "free",
      "sectionCount": 0,
      "tags": [
        "property",
        "realty",
        "housing",
        "listings",
        "agents"
      ]
    },
    {
      "id": "saas",
      "name": "SaaS",
      "description": "Software products, pricing, features, onboarding",
      "icon": "Laptop",
      "color": "#8b5cf6",
      "tier": "free",
      "sectionCount": 1,
      "tags": [
        "software",
        "subscription",
        "features",
        "pricing",
        "b2b"
      ]
    },
    {
      "id": "portfolio",
      "name": "Portfolio",
      "description": "Personal portfolios, project showcases, skills",
      "icon": "Briefcase",
      "color": "#ec4899",
      "tier": "free",
      "sectionCount": 1,
      "tags": [
        "personal",
        "projects",
        "showcase",
        "resume",
        "creative"
      ]
    },
    {
      "id": "blog",
      "name": "Blog",
      "description": "Articles, authors, categories, reading experiences",
      "icon": "BookOpen",
      "color": "#06b6d4",
      "tier": "free",
      "sectionCount": 0,
      "tags": [
        "content",
        "articles",
        "writing",
        "publishing",
        "authors"
      ]
    },
    {
      "id": "agency",
      "name": "Agency",
      "description": "Services, team, case studies, client work",
      "icon": "Users",
      "color": "#14b8a6",
      "tier": "free",
      "sectionCount": 0,
      "tags": [
        "services",
        "team",
        "clients",
        "business",
        "consulting"
      ]
    },
    {
      "id": "education",
      "name": "Education",
      "description": "Courses, instructors, learning paths, students",
      "icon": "GraduationCap",
      "color": "#f97316",
      "tier": "free",
      "sectionCount": 0,
      "tags": [
        "learning",
        "courses",
        "teaching",
        "students",
        "elearning"
      ]
    }
  ],
  "sections": [
    "ecommerce-hero",
    "portfolio-hero",
    "restaurant-menu",
    "saas-pricing"
  ],
  "stats": {
    "freeSections": 4,
    "proSections": 0,
    "totalDownloads": 0,
    "contributors": 1
  }
}